{
  "source": "website_form",
  "source_event_id": "web_v4_0006",
  "received_at": "2026-10-02T05:00:00Z",
  "customer": {
    "name": "Authenticated Vendor Test",
    "email": "authenticated.vendor.v4@example.com",
    "phone": "+1-555-555-0152"
  },
  "message": {
    "subject": "Authenticated solicitation filter test",
    "body": "We sell bulk contractor leads and advertising packages. This is a sales solicitation and not a construction-service request.",
    "channel": "form"
  },
  "metadata": {
    "page_url": "https://summit-ridge.example/contact",
    "utm_source": "v4_authenticated_test",
    "location_hint": null
  }
}
